{"equivalenceGroup":"stream-edge","exactError":null,"exactEvents":[{"data":{"accounting":{"estimated_cost":{"state":"unknown","value":{"reason":"pricing catalog not injected"}},"pricing_catalog_version":"unpriced","pricing_source":"provider_usage_only","provider_reported_cost":{"state":"unknown","value":{"reason":"provider did not report cost"}},"provider_request_id":{"state":"known","value":"msg_stream-edge"},"quota_remaining":{"state":"unknown","value":{"reason":"quota header not persisted in stream"}},"quota_reset_at_ms":{"state":"unknown","value":{"reason":"quota reset header not persisted in stream"}},"tokens":{"cache_read":{"state":"known","value":3},"cache_write":{"state":"known","value":2},"input":{"state":"known","value":11},"output":{"state":"known","value":1},"reasoning":{"state":"unknown","value":{"reason":"reasoning usage omitted"}}}}},"type":"usage"},{"data":{"text":"ok:stream-edge"},"type":"output_delta"},{"data":{"accounting":{"estimated_cost":{"state":"unknown","value":{"reason":"pricing catalog not injected"}},"pricing_catalog_version":"unpriced","pricing_source":"provider_usage_only","provider_reported_cost":{"state":"unknown","value":{"reason":"provider did not report cost"}},"provider_request_id":{"state":"known","value":"msg_stream-edge"},"quota_remaining":{"state":"unknown","value":{"reason":"quota header not persisted in stream"}},"quota_reset_at_ms":{"state":"unknown","value":{"reason":"quota reset header not persisted in stream"}},"tokens":{"cache_read":{"state":"unknown","value":{"reason":"cache usage omitted"}},"cache_write":{"state":"unknown","value":{"reason":"cache write usage omitted"}},"input":{"state":"unknown","value":{"reason":"input_tokens omitted"}},"output":{"state":"known","value":7},"reasoning":{"state":"known","value":0}}}},"type":"usage"},{"data":{"finish_reason":"stop","response_id":"msg_stream-edge"},"type":"completed"}],"invariants":["streaming","split-utf8","unknown-optional-event","duplicate-frame","out-of-order-frame","clean-end"],"parser":"anthropic","terminal":"completed"}
