{"equivalenceGroup":"roles-history","exactError":null,"exactEvents":[{"data":{"text":"ok:roles-history"},"type":"output_delta"},{"data":{"accounting":{"estimated_cost":{"state":"unknown","value":{"reason":"pricing catalog not injected"}},"pricing_catalog_version":"unpriced","pricing_source":"provider_usage_only","provider_reported_cost":{"state":"unknown","value":{"reason":"provider did not report cost"}},"provider_request_id":{"state":"known","value":"resp_roles-history"},"quota_remaining":{"state":"unknown","value":{"reason":"quota header not persisted in stream"}},"quota_reset_at_ms":{"state":"unknown","value":{"reason":"quota reset header not persisted in stream"}},"tokens":{"cache_read":{"state":"known","value":3},"cache_write":{"state":"unknown","value":{"reason":"cache write usage omitted"}},"input":{"state":"known","value":11},"output":{"state":"known","value":7},"reasoning":{"state":"known","value":0}}}},"type":"usage"},{"data":{"finish_reason":"stop","response_id":"resp_roles-history"},"type":"completed"}],"invariants":["roles","system","developer","user-assistant-history","unsupported-role-transform"],"parser":"openai","terminal":"completed"}
