{"equivalenceGroup":"limits-artifacts","exactError":null,"exactEvents":[{"data":{"text":"ok:limits-artifacts"},"type":"output_delta"},{"data":{"finish_reason":"length","response_id":"resp_limits-artifacts"},"type":"completed"}],"invariants":["limits","context-overflow","maximum-output","provider-truncation","oversized-tool-result","artifact-promotion"],"parser":"openai","terminal":"length"}
