{"equivalenceGroup":"parallel-partial-tools","exactError":null,"exactEvents":[{"data":{"id":"tool_a","name":"read"},"type":"tool_call_started"},{"data":{"id":"tool_b","name":"search"},"type":"tool_call_started"},{"data":{"id":"tool_a","json_fragment":"{\"path\":"},"type":"tool_arguments_delta"},{"data":{"id":"tool_b","json_fragment":"{}"},"type":"tool_arguments_delta"},{"data":{"arguments":{},"id":"tool_b"},"type":"tool_call_completed"},{"data":{"arguments":{"path":"README.md"},"id":"tool_a"},"type":"tool_call_completed"},{"data":{"accounting":{"estimated_cost":{"state":"unknown","value":{"reason":"pricing catalog not injected"}},"pricing_catalog_version":"unpriced","pricing_source":"provider_usage_only","provider_reported_cost":{"state":"unknown","value":{"reason":"provider did not report cost"}},"provider_request_id":{"state":"known","value":"resp_parallel-partial-tools"},"quota_remaining":{"state":"unknown","value":{"reason":"quota header not persisted in stream"}},"quota_reset_at_ms":{"state":"unknown","value":{"reason":"quota reset header not persisted in stream"}},"tokens":{"cache_read":{"state":"known","value":3},"cache_write":{"state":"unknown","value":{"reason":"cache write usage omitted"}},"input":{"state":"known","value":11},"output":{"state":"known","value":7},"reasoning":{"state":"known","value":0}}}},"type":"usage"},{"data":{"finish_reason":"stop","response_id":"resp_parallel-partial-tools"},"type":"completed"}],"invariants":["tools","one-tool","parallel-tools","interleaved-deltas","partial-json","empty-arguments","malformed-arguments","tool-error"],"parser":"openai","terminal":"completed"}
